[
  {
    "asset_id": "asset-ip-203-0-113-10",
    "asset_type": "ip",
    "value": "203.0.113.10",
    "organization": "Example Organization",
    "environment": "production",
    "criticality": "high",
    "ownership": {
      "confidence": 100,
      "status": "confirmed",
      "evidence": ["documentation test fixture"]
    },
    "relationships": [],
    "observations": [
      {
        "source": "documentation-fixture",
        "observed_at": "2026-08-23T12:10:00Z",
        "summary": "Example Internet-facing host",
        "freshness_days": 0
      }
    ],
    "tags": ["service:443:https", "service:8443:https"]
  },
  {
    "asset_id": "asset-ip-198-51-100-20",
    "asset_type": "ip",
    "value": "198.51.100.20",
    "organization": "Example Organization",
    "environment": "unknown",
    "criticality": "unknown",
    "ownership": {
      "confidence": 45,
      "status": "possible",
      "evidence": ["documentation-only relationship"]
    },
    "relationships": [],
    "observations": [
      {
        "source": "documentation-fixture",
        "observed_at": "2026-08-23T12:10:00Z",
        "summary": "Example potentially related asset",
        "freshness_days": 0
      }
    ],
    "tags": []
  }
]
